{
  "schemaVersion": "angit-attempt/v1",
  "attemptId": "att_demo",
  "projectId": "prj_demo",
  "taskId": "tsk_demo",
  "number": 1,
  "status": "reserved",
  "baseOid": "aaaaaaaaaaaaaaaaaaaaaaaaaaaaaaaaaaaaaaaa",
  "baseEpoch": 0,
  "coordinatorEpoch": 1,
  "fencingToken": 1,
  "worktreeId": "wt_demo",
  "runtimeProfileHash": "2222222222222222222222222222222222222222222222222222222222222222",
  "pid": null,
  "processIdentity": null,
  "startedAtMs": null,
  "endedAtMs": null,
  "submissionOid": null,
  "authorityIncarnation": "aaaaaaaaaaaaaaaaaaaaaaaaaaaaaaaaaaaaaaaaaaaaaaaaaaaaaaaaaaaaaaaa",
  "resourceKey": "task:tsk_demo",
  "ownerId": "owner_demo",
  "version": 0,
  "spawnIntentId": null,
  "terminationProof": null,
  "submissionTreeOid": null,
  "submissionRef": null
}
